{
  "apiVersion": 2,
  "id": "com.example.yolo-guard",
  "name": "YOLO Guard",
  "version": "1.0.0",
  "description": "Minimal launch policy: refuses every YOLO agent launch that is not in a plugin environment (a worktree, a container, a server). It has no launcher options; CanvasTTY asks it before every agent launch.",
  "author": "CanvasTTY contributors",
  "permissions": ["launch:contribute"],
  "services": [
    {
      "id": "guard",
      "title": "YOLO guard",
      "description": "Answers the launch policy for every agent launch.",
      "entry": "services/guard.mjs",
      "launch": { "policy": true, "fields": [] }
    }
  ],
  "contributions": []
}
